"","Subcategory","RQ","axialCode","initialCode","codeName","definition"
"142","1.8 - Past Experience","N","PE-NIH","PE-NIH","prior experience - NIH","Participant has followed the NIH guidelines for making publication free with the embargo period"
"143","1.8 - Past Experience","N","PE-OS","PE-OA","prior experience - open access","Describing a prior experience publishing open access (includes related experiences such as teaching others about OA)"
"144","1.8 - Past Experience","N","PE-OS","PE-OD","prior experience - open data","Describing a prior experience sharing data publicly (includes related experiences such as teaching others about OD)"
"145","1.8 - Past Experience","N","PE-OS","PE-OER","Prior Experience - Open Educational Resources","Describing a prior experience with OERs, E.g. they expressed they were on a task force to encourage OERs at their university. (includes related experiences such as teaching others about OERs)"
"146","1.8 - Past Experience","N","PE-OS","PE-OM","prior experience - sharing materials","Sharing protocols, stimuli, general materials that are not the manuscript."
"147","1.8 - Past Experience","N","PE-OS","PE-OPR","Prior Experience - Open Peer Review","Describing prior experience with open peer review process (includes related experiences such as teaching others about OPR)"
"148","1.8 - Past Experience","N","PE-OS","PE-PR","Prior Experience - Preregistration","Describing a prior experience preregistering a study or teaching others (e.g., their students) how to preregister"
"149","1.8 - Past Experience","N","PE-OS","PE-SA","prior experience - self-archiving","Participant describes their previous experience self-archiving. The comment indicates that the participant is doing the self-archiving, or teaching someone else to self-archive."
"150","1.8 - Past Experience","N","PE-OS","PE-SARP","prior experience - self-archiving research products","Presentation slides and posters, NOT manuscript"
"151","Graveyard","N","PW","PW","Personal website","Using a personal website for OS purposes (personal, lab website)"
"152","1.9 - Resources","N","R-UCSD","R-UCSD","Resources - used CSDisseminate resources","Participant has utilized CSDisseminate resources (e.g., referenced website, attended a training)"
"153","1.5 - Self Perception","N","SJ","SJ","Self Judgement","Participant demonstrates self-judgement about how they do or do not engage in OS practices, speaking more generally and not as a specific barrier to engaging in OS. Participant expresses they feel like a ""lousy"" or ""bad"" researcher because they do/do not do an OS practice."
"154","1.7 - Training","N","TE-BTT","TE-PD","Training Experience - Post Doc","Participant discusses training they received during a post doc"
"155","1.7 - Training","N","TE-BTT","TE-PhD","Traning experience - PhD","Discussed attending OS trainings during PhD program"
"156","1.7 - Training","N","TE-LFO","TE-CS","Training Experience - Collaborator Support","Participant expresses that workign with a collaborator taught them alot about OS/an individual OS practice"
"157","1.7 - Training","N","TE-LFO","TE-LFO","Training experience-learning from others","Participant discusses learning about OS/how to engage in OS through seeing how others engage in OS (e.g., seeing what others share on OSF) or talking with others about OS"
"158","1.7 - Training","N","TE-M ","TE-P","Training Experience - Podcast","Mentions they have learned about OS through a podcast"
"159","1.7 - Training","N","TE-M ","TE-SM","Training Experience - Social Media","Participant says that they have learned about OS/OD/OA/SA/PR through social media"
"160","1.7 - Training","N","TE-M ","TE-V","Training Experience - Videos","Training was received through videos (e.g Youtube)"
"161","1.7 - Training","N","TE-NE","TE-NE","Training experience - not extensive","Previous training (either a specific webinar OR training experience in general with OS) was not extensive"
"162","1.7 - Training","N","TE-NT","TE-NT","Training experience - no training","Discussed not having any preious OS training experience "
"163","1.7 - Training","N","TE-OS","TE-OA","Training Experience - Open Access","Specifically discussed training experience with open access"
"164","1.7 - Training","N","TE-OS","TE-OD","Training experience - open data","Specifically discussed training experience with open data"
"165","1.7 - Training","N","TE-OS","TE-OER","Training experience- Open educational resources","Participant discussed receiving training about open educational resources."
"166","1.7 - Training","N","TE-OS","TE-OM","Training Experience - Open Materials","Training experience relating to open materials (i.e. sharing code)"
"167","1.7 - Training","N","TE-OS","TE-OR","Training Experience - Open Resources","Training was received by accessing online materials hosted by different organizations (i.e. OSF, Society for Neuroscience)"
"168","1.7 - Training","N","TE-OS","TE-OS","Training experience - open science","Discussed previous training with OS but did not specify which practice"
"169","1.7 - Training","N","TE-OS","TE-PR","Training experience - preregistration","Discussed attending training related to preregistration"
"170","1.7 - Training","N","TE-OS","TE-SA","Training Experience - Self Archiving","Participant describes a training experience with self-archiving"
"171","1.7 - Training","N","TE-PRES","TE-CP","Training Experience - Conference Presentation","Participant says that they have learned about OS/OD/OA/SA/PR through a conference presentation"
"172","1.7 - Training","N","TE-PRES","TE-W","Training Experience - Workshop or Webinar","Training on OS - attended a workshop or webinar (ex. CSDisseminate webinar)"
"173","1.10 - Knowledge","N","U-OA","U-OA","Uncertainty - Open Access","Participant expresses uncertainty related to the open access process, including what counts as OA or the different types of OA"
"174","1.10 - Knowledge","N","U-OD","U-OD","Uncertainty - open data","Being unsure what they are allowed to do/share (related to open data)"
"175","1.10 - Knowledge","N","U-OER","U-OER","Uncertainty - Open Educational Resources","Being unsure what OERs are, or how to engage with OERs"
"176","1.10 - Knowledge","N","U-OS","U-OS","uncertainty - open science practices","Being unsure what 'counts' as an open science practice, or generally not knowing how to engage in OS practices"
"177","1.10 - Knowledge","N","U-PR","U-PR","Uncertainty - Preregistration","Being unsure what they are allowed to include in a preregistration or how to preregister (e.g., what to include in stats analysis plan)"
"178","1.10 - Knowledge","N","U-SA","U-SA","Uncertainty - self-archiving","Being unsure of the procedures for SA."
"179","3.1 - Information","3","WTL-IP","WTL-IP","Want to Learn - Institutional procedures","Participant expresses wanting to learn about their institution's specific OS procedures"
"180","3.1 - Information","3","WTL-IRB","WTL-IRB","Want to Learn - IRB","Participant expresses wanting to learn their institution's IRB procedures"
"181","3.1 - Information","3","WTL-OA","WTL-OA","Want to Learn - Open Access","Participant expresses wanting to learn about open access"
"182","3.1 - Information","3","WTL-OD","WTL-OD","Want to Learn - Open Data","Participant wants to learn about open data. How to do it, how to work with the IRB to approve it, where to share it, etc."
"183","3.1 - Information","3","WTL-OER","WTL-OER","Want to Learn - Open Educational Resources","Participant expresses wanting to learn about open educational resources"
"184","3.1 - Information","3","WTL-OPR","WTL-OPR","Want to Learn - Open Peer Review","Participant wants to learn about open peer review process"
"185","3.1 - Information","3","WTL-OS","WTL-OS","Want to Learn - Open Science","Participant expressed that they want to learn about all open science practices or didn't specifiy specific practices"
"186","3.1 - Information","3","WTL-OSW","WTL-OSW","Want to learn- open science workflow","Participant expresses wanting to learn more about how to build open science practices into their workflow"
"187","3.1 - Information","3","WTL-PR","WTL-PR","Want to Learn - Preregistration","Participant wants to learn about preregistrations, where to register them, how, etc."
"188","3.1 - Information","3","WTL-SA","WTL-SA","Want to Learn - Self-Archiving","Partiicpant wants to learn about self archiving"
