Page,Line,Author,Date & Time,Comment,Reference Text
8,30,Austin Thompson,8/14/2023 19:49,B-CX,"And so I just need to understand, like for me, facilitating this process would be. I need to figure out what is my hierarchy? Who do I talk to? How do I get this all figured out?  Which could be a me problem and it's not something that everyone else deals with. But...it's...there's just a lot out there. Of like layers."
8,30,Austin Thompson,8/14/2023 19:48,"B-SA, B-I","The other element of this is that I am at a university that is a regional campus of a flagship state school. And so there's department, college, university here and then there is what we jokingly refer to as the mothership downstate. And then there's all of their rules. And so I just need to understand, like for me, facilitating this process would be. I need to figure out what is my hierarchy? Who do I talk to? How do I get this all figured out?  Which could be a me problem and it's not something that everyone else deals with. But...it's...there's just a lot out there. Of like layers."
8,34,Austin Thompson,8/14/2023 19:50,M-SA,"In I think my first year of my faculty position I was really motivated to self-archive, and have, you know, really accessible on my website a list of all of my manuscripts that are available."
8,42,Austin Thompson,8/14/2023 19:49,B-SA,"Yeah, to kinda to follow up to that comment. In I think my first year of my faculty position I was really motivated to self-archive, and have, you know, really accessible on my website a list of all of my manuscripts that are available. And so, I had a grad student take some time, and you know, figure out the requirements to the best of her knowledge, and tell me which copies of things. And so then I went to the person who manages the faculty websites, and said, hey, I want to do this thing. It's this movement within the field to be more transparent, open. And she said. Oh, well, a lot of faculty end up forgetting to update their manuscript list, so we just don't allow them to be posted at all. So like well, you know. So that was just one example of trying to put in the work and then meeting resistance due to all of these layers, and figuring. Well, you know. This should be a straightforward thing. But there's all these things that make it difficult to actually implement."
8,42,Austin Thompson,8/14/2023 19:51,B-I,"And so then I went to the person who manages the faculty websites, and said, hey, I want to do this thing. It's this movement within the field to be more transparent, open. And she said. Oh, well, a lot of faculty end up forgetting to update their manuscript list, so we just don't allow them to be posted at all. So like well, you know. So that was just one example of trying to put in the work and then meeting resistance due to all of these layers, and figuring. Well, you know. This should be a straightforward thing. But there's all these things that make it difficult to actually implement."
8,42,Austin Thompson,8/14/2023 19:51,PE-SA,"In I think my first year of my faculty position I was really motivated to self-archive, and have, you know, really accessible on my website a list of all of my manuscripts that are available. And so, I had a grad student take some time, and you know, figure out the requirements to the best of her knowledge, and tell me which copies of things. And so then I went to the person who manages the faculty websites, and said, hey, I want to do this thing. It's this movement within the field to be more transparent, open. And she said. Oh, well, a lot of faculty end up forgetting to update their manuscript list, so we just don't allow them to be posted at all. So like well, you know. So that was just one example of trying to put in the work and then meeting resistance due to all of these layers, and figuring. Well, you know. This should be a straightforward thing. But there's all these things that make it difficult to actually implement."
8,42,Austin Thompson,8/14/2023 19:52,B-CX,This should be a straightforward thing. But there's all these things that make it difficult to actually implement.
9,5,Austin Thompson,8/14/2023 19:52,PE-OA,"But in my department we're really lucky that we have a clinic that makes a little bit of money, and we're actually able to pay."
9,7,Austin Thompson,8/14/2023 19:52,"B-OA, B-M","I think the biggest barrier is, where do you find the funds to be able to pay for open access? I think that's the biggest in smaller departments like ours."
9,11,Austin Thompson,8/14/2023 19:57,"B-OA, B-M, B-R","I would add that that the funding is a huge issue. Specifically, when you're not in an R rated institution right? Because we don't have research assistance. We don't have lab space. We don't have let alone, just flat out cash to pay for an open access readership."
9,17,Austin Thompson,8/14/2023 19:57,"B-OA, B-M","That's what I was gonna share is just the cost associated with it. My university university doesn't have a lot of funding. I have no experience with grant writing, so I don't even really know how to access funding for opportunities like this."
9,17,Austin Thompson,8/14/2023 19:58,U-OA,"I have no experience with grant writing, so I don't even really know how to access funding for opportunities like this."
9,32,Micah Hirsch,8/16/2023 23:26,"F-OA, F-M","I would say. A facilitator has been when I have grant funds, and I can pay for it."
9,34,Austin Thompson,8/24/2023 16:45,"B-OA, B-R, B-M","But you know I I am at an institution that it's an R2, specifically, and the vibe here has always been uou pay for it yourself."
9,40,Micah Hirsch,8/16/2023 23:35,"F-OA,F-IS, F-M","Also, if you know, the Dean of the college is willing to put his or her money where his or her mouth is, or their money, in terms of having a pot of money for faculty to pull from. I think X had previously mentioned that at her institution their library has some money to pay for open access."
9,43,Austin Thompson,8/24/2023 16:43,"B-OA, B-M, B-R","I know my library also has that, but the money is distributed equally between authors. So if there's three authors on my paper, my library is only going to pay for the one-third for me, and then the other 2 thirds, even even if I'm first author, then the other 2 thirds need to be covered by someone else. So that makes it a little bit difficult at my institution."
9,45,Micah Hirsch,8/16/2023 23:36,"F-OA, F-M, F-IS","So having a pot of money either at the library or within the Dean's office, would be really helpful.<P>"
10,9,Micah Hirsch,8/16/2023 23:38,"B-OA, B-M, IE-OA"," maybe this is just me being idealistic, but you know we already don't get any financial kickback from publishing, and so I feel like the cost associated with publishing open access is pretty inequitable. We, I mean, at my university unfortunately, like we are, we we don't get paid like a very high salary and trying to bridge that research to practice gap through open access, then basically punishing us by making us pay for something when we already don't get any monetary gain from publishing it. Personally, it makes no sense to me, so I don't see like, if the idea is open access, then why do we have to pay still for open access? That seems like it doesn't accomplish the spirit of open access science."
10,16,Micah Hirsch,8/16/2023 23:45,IE-OA,"So just add to that, I would also say, I also think it kind of defeats the purpose of open access, and that it's supposed to be for everyone and make this, I would think, a more like transparent and diversified research environment where it, when it's paid for it, kind of limits who can participate in that. And what type of research is even getting published on it."
10,26,Danika Pfeiffer,9/22/2023 21:11,"B-LOB, B-NE","I don't perceive a lot of benefit to myself, and that sounds selfish because it is, but I have to watch out for my own time. And so yeah, I just don't see a lot of external motivation,"
10,28,Micah Hirsch,8/16/2023 23:51,B-OD,"I don't perceive a lot of benefit to myself, and that sounds selfish because it is, but I have to watch out for my own time. And so yeah, I just don't see a lot of external motivation, and it’s opening up myself up to potential criticism. Not that I think that there's anything wrong with my stimuli. But yeah, just lack of external motivation or incentives."
10,28,Danika Pfeiffer,9/22/2023 21:10,"B-LOB, B-NE","But yeah, just lack of external motivation or incentives."
10,32,Micah Hirsch,8/16/2023 23:52,"B-OD, B-T","I think also in terms of protocols or more of like my R syntax, or something like that, is taking the time to clean it up. Rather than like the shorthand that it's currently in to be able to make it readable by someone else, just taking the time to to clean it up and make it public facing"
10,39,Micah Hirsch,8/17/2023 0:01,"F-OD, F-W, F-KOP","I know a lot of grant applications these days do require you to have some kind of data management policy, particularly with the focus on open data and data sharing. So I think just a better maybe understanding of what the...you know, what's required in terms of the the funders and grantors. And what what kind of data they want us to share, and where they'd like us to share it."
10,43,Micah Hirsch,8/17/2023 0:01,"B-OD, B-R","As as supportive as our library is our ITS is maybe not so much so. We don't have access to some of the the programs like. Of course, now I can't think of it. We have Qualtrics, but we don't have what's it called? Red Cap. Thank you. Because they have some concerns about you know, anyways. So that's been the the bane of my existence recently, but just having access to some of those database programs as well."
11,5,Micah Hirsch,8/17/2023 0:07,F-KOP,More knowledge
11,5,Micah Hirsch,8/17/2023 0:07,F-OD,More knowledge. an existing infrastructure
11,5,Micah Hirsch,8/17/2023 0:07,F-CR,an existing infrastructure
11,10,Micah Hirsch,8/17/2023 0:13,F-KOP,Like what is best practice? I think there is another comment in the chat about that. Like how to best do it.
11,11,Micah Hirsch,8/17/2023 0:13,F-NIH,"I know some NIH institutes have repositories and have it very clearly spelled out, while other institutes leave you to your own devices to do it"
11,12,Micah Hirsch,8/17/2023 0:13,F-KOP,So how do we go about doing it? Because it is required by many grants now.
11,12,Micah Hirsch,8/17/2023 0:13,F-OD," Like what is best practice? I think there is another comment in the chat about that. Like how to best do it. I know some NIH institutes have repositories and have it very clearly spelled out, while other institutes leave you to your own devices to do it. So how do we go about doing it? Because it is required by many grants now."
11,20,Micah Hirsch,8/17/2023 0:15,"F-OD, F-NIH","I think the you know direction NIH is going is really going to be a benefit as as money growing pains as it gave me at the beginning of this year. You know I do think it's going to encourage our institutions to kind of step up to the plate a little bit in, you know, helping to facilitate open data."
11,29,Micah Hirsch,8/17/2023 0:16,IOS-RR,"I guess it will facilitate a lot of replication studies. You can use the same stimuli, same protocol. Everything is available online. You can use it. Say, like a different population of same population that replicate those results"
11,32,Micah Hirsch,8/17/2023 0:16,IOS-RPG,I would hope it would also facilitate research getting to practice more quickly as clinicians could locate things without cost to themselves.
11,44,Micah Hirsch,8/17/2023 0:20,IOS-Tr,"I think that there's also an element of sharing what the research process is truly like with clinicians. I know as a clinician I didn't completely understand, like, in order to get through IRB or in order to move the publication process along exactly how narrow any given research study needed to be. And I think the more that clinicians, we pull back the veil a little bit on like how the science is produced. Then clinicians can better understand, like how this is being created. And so, then there is mutual understanding on both sides of, we want you to have access to the science. We want you to know how we create the science. Or, you know, discover things. So I just think it makes it just a little bit more. Hmm. Knowledge. There's more knowledge for everyone in in the procedures of it all."
12,2,Brittany Ciullo,8/17/2023 22:07,IOS-T,"I also use it in my teaching. So, getting, introducing all of the things that were just spoken to students, before they're clinicians."
12,9,Brittany Ciullo,8/17/2023 22:07,IOS-SIR,"That's what I was going to say was getting students interested in and acclimated to research and showing them that it doesn't have to be this big scary process. I think data collection can feeI, I know for me, when I was a student researcher, that data collection was really overwhelming. As well as developing methodology. So, seeing what's out there, and seeing how I can tweak it to my interests, I think would have... I was really interested but I think it might have recruited more of my classmates into research."
12,18,Brittany Ciullo,8/17/2023 22:10,IOS-LS,"Also, just to add that you know, in our field we tend to have fairly small N studies just because of accessibility of research participants. And so you know the more that we share things openly, particularly data in that sense, it's easier to combine results from different studies to to sort of answer, maybe different questions than we could answer individually in our little, you know, silos."
12,24,Brittany Ciullo,8/17/2023 22:10,CI-FC,"I think it might be a good way to meet collaborators and maybe expand what you're looking at, and who you're working with."
12,29,Brittany Ciullo,8/17/2023 22:12,CI-MR,"I guess it should have helped me in taking up projects that you know I I didn't have enough technical skills on. If I had the protocol ready stimulus ready from somebody else... in general, it would have helped me in taking up more projects that conceptually make sense to me, but not really have matlab skills or python skills to run the protocols."
12,33,Brittany Ciullo,8/17/2023 22:17,CI-MR,I think it could help cut down on redundancy of lots of research groups doing the same sort of work in terms of getting stimuli processed and recorded and edited and cut out all that sort of extra work and allow us to focus more on doing the actual research
12,37,Brittany Ciullo,8/17/2023 22:21,CI-SR,"in terms of me, potentially doing more open science practices, I think it could potentially help people to have more faith in the type of research that I'm doing and view me as a stronger researcher if I'm consistently doing more of these open science practices, potentially. If it becomes something that people value more and becomes more common."
12,41,Brittany Ciullo,8/17/2023 22:27,CI-MC,"I know some institutions really look at the H index and things like that like how often you're being cited, and so, if more work is open access, then more people can cite your work"
12,43,Brittany Ciullo,8/17/2023 22:28,CI-LA,"And then that kind of boosts those scores for those institutions that are really looking for you to have a really broad reach, rather, whether it's nationally or internationally"
12,43,Brittany Ciullo,8/17/2023 22:27,CI-PT,"Also for some it might help with the tenure process. I know some institutions really look at the H index and things like that like how often you're being cited, and so, if more work is open access, then more people can cite your work. And then that kind of boosts those scores for those institutions that are really looking for you to have a really broad reach, rather, whether it's nationally or internationally, to show that your your work is having an impact in your field."
12,46,Brittany Ciullo,8/17/2023 22:33,CI-LA,"I think the research that I have done, and I'm going to be doing is really cool, and I want other people to read it"
13,4,Brittany Ciullo,8/17/2023 22:33,CI-LA,so getting my name out there and letting people see what I've done. And then just becoming like a name in the field. That's one of my career aspirations.
13,14,Brittany Ciullo,8/17/2023 22:37,WTL-OS,"I would just be...like, I'm just curious about what open science looks like within other fields. And how our field compares. Because typically, since we're newer, we're a little bit behind. And so I'm curious to see like what other fields of research and what other professions have embraced open science and what that looks like for them."
13,19,Danika Pfeiffer,9/22/2023 21:36,"F-OS, F-CS","I just suggested that if there's any way to get a list of mentors, let's say, maybe in a different category of institutions."
13,21,Brittany Ciullo,8/17/2023 22:41,"B-OS, B-KOP","Like I'm at an R2 institution. So we're...and I’d done my PhD in an R1, and I found that just that little change in category makes a huge difference in what's available to us, as far as knowledge and process and procedures"
13,23,Danika Pfeiffer,9/22/2023 21:36,"F-OS, F-CS","So having, maybe somebody who is in our particular institutional category to help step us through maybe some unique procedures and processes that are preventing us from being more involved."
13,32,Brittany Ciullo,8/17/2023 22:45,"F-OS, F-CR","I'm, thinking in terms of resources for those of us whose institutions are less familiar with open science, it may be helpful just to have a a list or some sort of reference, to be able to give to our institutions, or give to our library, saying why this is important. You know, what are the benefits, and what are the barriers, so that you know, it's not just each of us fighting the fight individually."
