Page,Line,Author,Date & Time,Comment,Reference Text
1,12,Austin Thompson,8/17/2023 17:18,LPE-OS,So I don't know necessarily that I've had any experience with using open science practices.
1,14,Austin Thompson,8/17/2023 17:19,"TE-OA, TE-W","I have attended continuing education sessions on how to access research more easily, and to avoid paying for articles and getting around paywalls."
1,15,Austin Thompson,8/17/2023 17:19,LPE-OS,"But other than that, I haven't really had much opportunity."
1,19,Austin Thompson,8/17/2023 17:22,"TE-NE, TE-OS","I would second that I would say. During my training, and even through, I would say, local continuing education at my university. I have not had much experience with open science practices."
1,20,Austin Thompson,8/17/2023 17:25,"PE-OA, PE-OM, IOS-Tr","I am trying to be more transparent about my work, and like using like posting protocols and trying to publish open access when possible."
1,21,Austin Thompson,8/17/2023 17:26,"B-OD, B-CX","And then sharing data is a little more complicated, I would say, from my perspective."
1,31,Austin Thompson,8/17/2023 17:30,"F-OA, F-M","And so there's money that researchers can apply for to support open acc...to cover the open access fees for publishing in an open access journal. They also have some. The University has some relationships, I guess, with Elsevier, or other things where we can also publish in certain journals. We can publish in a non- open access journal, but cover the open access fees through that. "
1,31,Austin Thompson,8/17/2023 17:29,"F-IS, F-OA","So I work at a university, and our library, our librarians are very active in increasing...sorry my cat...open access, so they do a lot of training. We have an open access publication fund that was supported by the librarians. And so there's money that researchers can apply for to support open acc...to cover the open access fees for publishing in an open access journal. They also have some. The University has some relationships, I guess, with Elsevier, or other things where we can also publish in certain journals. We can publish in a non- open access journal, but cover the open access fees through that. "
1,38,Austin Thompson,8/17/2023 17:30,"F-OA, F-IS","And we also have a Scholar Works which is the institutional repository. So when...and I don't know that that's really caught on super widely in the university. But they are trying to do a lot to get the word out that when when researchers, you know whether they be faculty, staff, lecturors at the university publish, they can put them in that repository, and then they're available to people within institution, which, as in, as I understand, is a little more. You know, you can do that before you before the embargo date, since it's not technically public."
1,43,Austin Thompson,8/17/2023 17:31,LPE-OS,"Yeah, i'll go ahead if that's okay. Let's see. I haven't done a whole lot related to open science exactly."
1,44,Austin Thompson,8/17/2023 17:32,"TE-OS, TE-P","I've listened to several different podcasts talking about the various aspects of open science, so I feel like I have a decent understanding of the different components of it."
1,45,Austin Thompson,8/17/2023 17:32,LPE-OS,But haven't implemented.
1,46,Austin Thompson,8/17/2023 17:33,"LPE-OD, LPE-OA","Let's see, like I haven't posted data publicly before, code or published anything, paid extra to publish open access, or done any registered reports or anything."
2,3,Austin Thompson,8/17/2023 17:34,"PE-SA, B-SA, B-I","I tried to put up free, legal versions of previous manuscripts on my department website, but was told that I had to adhere to a particular format that didn't allow for publications to be posted on there. So, as it turns out, I wasn't able to."
2,4,Austin Thompson,8/17/2023 17:35,MUR,But I respond quickly to requests on Research Gate. When people do request articles.
2,6,Austin Thompson,8/17/2023 17:36,MUR,"So, I have tried to post anything I can on my research gate."
2,8,Austin Thompson,8/17/2023 17:38,"PW, PE-PR, PE-OM","I don't have a personal website yet, but I have posted preregistrations on OSF and I've posted some R scripts and some stimuli."
2,8,Micah Hirsch,10/10/2023 16:40,_Marked as resolved_,"I don't have a personal website yet, but I have posted preregistrations on OSF and I've posted some R scripts and some stimuli."
2,8,Micah Hirsch,10/10/2023 16:41,_Re-opened_,"I don't have a personal website yet, but I have posted preregistrations on OSF and I've posted some R scripts and some stimuli."
2,8,Austin Thompson,8/17/2023 17:38,LPE-OD,I haven't shared data yet.
2,9,Austin Thompson,8/17/2023 17:39,PE-OA,But have been paying for open access and things like that as well.
2,12,Austin Thompson,8/17/2023 17:41,"PE-OA, PE-SA","So yeah, I have published in open science journals and uploaded my papers on Bio archive for public accessibility."
2,13,Austin Thompson,8/17/2023 17:43,IOS-A,I have only heard positive responses from people who have downloaded them and had access to the manuscripts.
2,14,Austin Thompson,8/17/2023 17:43,PE-OM,I've also uploaded stimuli and experiment protocols on Github.
2,15,Austin Thompson,8/17/2023 17:44,"IOS-A, IOS-RR","And I do agree with the statement I see here is that it increases the accessibility, transfer, and replicability of science."
2,25,Danika Pfeiffer,9/22/2023 21:09,"TE-W, TE-OS, R-UCSD","So I did do a CSDisseminate webinar, maybe"
2,29,Austin Thompson,8/17/2023 17:46,"TE-OS, TE-SA, TE-CS","But most of my open science practice knowledge was built individually through conversations with other scientists who were working their way through the process. Or recommended like a research gate for sending articles, or walked me through which exact manuscript draft it was the one to save that could be legally shared. Yeah. and you say it. It's a lot of individual instruction at the beginning."
2,37,Danika Pfeiffer,9/22/2023 21:08,"TE-NE, TE-W, TE-OS, R-UCSD","I think I did a CSDisseminate something a webinar, whatever it was some time ago, but otherwise I I mean, I've had very little formal instruction on open science. It wasn't really a model that was emphasized in my Phd training. I didn't really see that from my Phd mentors. "
2,37,Austin Thompson,8/17/2023 17:49,PE-OM,A little bit of OSF. Posting some stimuli there.
2,40,Austin Thompson,8/17/2023 17:50,"TE-NE, TE-OS, TE-P, TE-SM, TE-W, A-OS","But it wasn't really emphasized or not right, encouraged very much. So otherwise. Yeah. What, a Webinar here, there, some podcasts, and then seeing things on Twitter. People encouraging open science practices."
2,46,Austin Thompson,8/17/2023 17:51,"TE-OS, TE-NT","I'll also add, so I didn't do a postdoc. I went straight from a Ph.D. right into an assistant professor position, and I feel like the friends that I have that are currently in postdocs or just wrapping up have been able to get that training, so I feel like it's blossoming right now and some of us that have graduated, you know, 4 5 6 years ago. Kind of missed the train a little bit on all that training that's coming out."
3,4,Austin Thompson,8/17/2023 17:52,"TE-PR, TE-CS","So, someone that I've recently collaborated with that is a postdoc has actually taught me quite a bit, and that's how I've gotten kind of more exposure and comfort with OSF and pre registrations and posting things like that. So? I would agree with X if I'm pronouncing your name correctly? In that it's been a lot of like one-on-one individualized kind of support from colleagues."
3,6,Austin Thompson,8/18/2023 14:08,"TE-OS, TE-CP","Yeah, I added, I attended a training session at a conference. It was a formal training session."
3,8,Austin Thompson,8/18/2023 14:09,"TE-OA, TE-CP",I I attended that conference there was a discussion and the need for open access and all that.
3,9,Austin Thompson,8/18/2023 14:09,"TE-OS, TE-PD","So, I I receive formal training during a postdoctal experience."
3,22,Austin Thompson,8/18/2023 14:10,"TE-NT, TE-OS","And we, in my PhD program, we haven't talked about open science practices, and it was more my experience with it, is more from when I was wrapping up my clinical practice kind of phase of my career, and where I was sort of reading about, and hearing that this was a way that as a consumer I could sort of get that information. And I have not had much about being like much training about being a producer of science, and how to get that out. There was more about like this is how you can access it when you need it. Not how you get it out."
3,27,Austin Thompson,8/18/2023 14:13,"F-IS, F-OER, TE-OER","So my university library has talked about open education resources,"
3,29,Austin Thompson,8/18/2023 14:14,"B-OS, B-OA, B-NE","but because my university is not a research focused university, I don't think open access for research is as much of a concern. Especially because our tenure and promotion expectations are going to be lower because we're not a research focused institution."
3,38,Austin Thompson,8/18/2023 14:15,WTL-PR,"I really feel that I would like to know the process. You know, so not just here's the practice. But what is the process around preregistering and submitting."
3,39,Austin Thompson,8/18/2023 14:15,LP-P,"And what exactly, step by step, more procedural, I guess. I'm very good about following procedures."
3,44,Austin Thompson,8/18/2023 14:16,"TE-NT, TE-OS","You know I have an ORCID ID, and and that was kind of the focus on my PhD program was making sure we had that. But there was no discussion, as somebody else had mentioned, on open science. It was really...I was at an R1 institution, and it was all about grant writing and and submitting for NIH and all that. I was in implementation science courses. And so that was a whole different beast. "
3,44,Austin Thompson,8/18/2023 14:17,LP-P,"So yeah, I just think a procedure would be very helpful."
4,1,Austin Thompson,8/18/2023 14:17,LP-P,"I would say, in addition to the procedure. I also like like, step by step"
4,4,Austin Thompson,8/18/2023 14:18,"B-OS, B-F, B-KJP","and you know, as a pre- tenure assistant professor, I'm also very conscious of making sure that that I have data to publish, and making sure that I'm not just looking negative in any way to potential publishers. And unfortunately, that's just the reality of it."
4,6,Austin Thompson,8/18/2023 14:19,WTL-OS,"However, I would say, all of the above in terms of your list here. I would attend a session on any of this. And also yeah, just knowing my limits and what I can do."
4,6,Austin Thompson,8/18/2023 14:20,LP-P,What's the appropriate step-by-step procedure to follow?
4,10,Austin Thompson,8/18/2023 14:23,"B-SA, B-F","Because that's kind of been my limiting factor, and just again making sure I I do it right, and I kind of protect myself pre tenure."
4,10,Austin Thompson,8/18/2023 14:22,"B-KJP, B-SA, LP-PPOV","And I would love to hear that from a publisher standpoint. I would love to hear from. You know someone who who does work for a peer-reviewed publication to say, this is okay, this is not. Because that's kind of been my limiting factor, and just again making sure I I do it right, and I kind of protect myself pre tenure."
4,17,Austin Thompson,8/18/2023 14:23,"B-SA, B-F, B-KJP","I agree with that. I would also say that the self-archiving piece always kind of makes me worry that someone mentioned previously about which version you're going to put out there, and I'm always really nervous unless I have an open access paper that I paid for. I know I can put that anywhere, but if it's not open access like which version can I put up individual independently, because I don't want to like have to go to court because I did something wrong. I'm probably catastrophizing it, but that for me."
4,19,Austin Thompson,8/18/2023 14:24,LP-P,"Procedurally I've learned about it, but it would be really great to have like a step-by-step like this is the version you upload. If you have this kind of level of copyright, etc.,"
4,23,Austin Thompson,8/18/2023 14:24,LP-PPOV,I'd like to to add that not only would it be helpful to hear it from the publisher's point of view. 
4,24,Austin Thompson,8/18/2023 14:26,WTL-IP,"But I would really, really love a talk through on each of those topics. That's specific to my institution. "
4,27,Austin Thompson,8/18/2023 14:26,"B-R, B-OS, B-OD",Because I really do feel often that I am fighting a fight without the support of the librarians that that would be so beneficial to me. Which person do I need to talk to? To talk about the open data processes within my institution. Which person do I need to talk to? For. Yeah. You get the idea.
4,31,Austin Thompson,8/18/2023 14:27,"WTL-OA, WTL-IP, B-OA, B-M","For me, You know. I'm curious about like how to kind of manage the cost of publishing open access. Because typically, just to publish doesn't cost anything but making it open access adds a cost. So, I don't know if my university would be willing to cover that."
4,34,Austin Thompson,8/18/2023 14:28,"B-OD, B-IRB, B-F","Additionally, you know, my IRB, sometimes I I perceive them as kind of like worrying about things excessively. So if I were to share data openly, I'm worried that the IRB would shut that down at my university, or I would face backlash from them."
4,36,Austin Thompson,8/18/2023 14:28,LP-P,"Yeah, so I think like just kind of knowing how to navigate those issues would be helpful for me to know, kind of like the best place to start, and then the best way to move forward with it."
4,46,Austin Thompson,8/18/2023 14:30,"WTL-OD, WTL-IRB, P-OD","So similarly. Yeah, from the IRB perspective, just knowing if it's okay to post the identified data publicly. If I didn't explicitly, write that in the IRB. And in the consent form. Yeah, is a question of mine,"
5,3,Austin Thompson,8/18/2023 14:31,"WTL-SA, PE-SA, U-SA"," and then in terms of self archiving. So I've done preprints before, but I'm always sort of unclear about okay. Once that actually gets accepted and published. What do I do with the preprint? Do I leave it up? Do I update it? Do I take it down? I don't know. I could probably figure it out. But I don't know at this point."
5,4,Austin Thompson,8/18/2023 14:31,WTL-OER,"And then, in terms of another topic, open educational resources is something I don't know a whole lot about from this list."
5,14,Austin Thompson,8/14/2023 18:38,"LP-W, LP-I","Yeah, for me. Just the way, I learn an interactive workshop would be best for me, which I know takes more time. But you know, having something where I get to walk through what that process looks like with someone have a live discussion about it. Which you don't, get that like always good question and answer within a live webinar and you don't have that opportunity within a pre-recorded webinar."
5,14,Austin Thompson,8/14/2023 18:38,LP-H,Handouts.
5,28,Austin Thompson,8/14/2023 18:41,LP-V,"I would just add Youtube videos, I mean, I know that those are, you know. It's nice to have something where you can jump around pretty easily. So Youtube videos that are tagged with chapters or things like that so you can listen to a little bit at a time. Or find the bit that you need. I think, sometimes pre recorded webinars, it's a little bit more difficult, depending on the format, for me to find the information that I need within the the Webinar. So Youtube videos tend to break things down, and sometimes I don't have more than 5 minutes, you know, between jumping around with different tasks"
5,28,Austin Thompson,8/14/2023 18:41,LP-S,"So Youtube videos tend to break things down, and sometimes I don't have more than 5 minutes, you know, between jumping around with different tasks, to be able to find what I need."
5,32,Austin Thompson,8/14/2023 18:42,"LP-I, LP-W, LP-H, LP-V","Yeah. So sorry I'll add my 2 cents that interactive workshop, handouts, and Youtube videos are three avenues that I use regularly to learn from. So, if it was in at least those three formats, it would be helpful to me."
5,37,Austin Thompson,8/14/2023 18:48,"LP-V, LP-H","I agree. I like that, you know, with with handouts and Youtube videos specifically. You know, you can access those when you're ready for the information, because I think you know, open science as a whole is a very big, broad topic. And so, you know. Being able to target those, like someone you had mentioned like tagged sections."
5,39,Austin Thompson,8/14/2023 18:48,LP-A,"I think it's really helpful to get that information when you need it, and I think that's been a contributing factor to me not attending webinars in the past, just because I wasn't ready for the information."
5,41,Austin Thompson,8/14/2023 18:49,LP-A,I think also just ease of finding prerecorded webinars is sometimes difficult.
5,43,Austin Thompson,8/14/2023 18:49,LP-S,Or just having them in really short snippet. So here's a 5 minute introduction on X or on Y
6,1,Austin Thompson,8/14/2023 18:50,LP-H,"and then, having, you know, a handout that's related to it, so that you have, like the step-by-step on a piece of paper that you could potentially follow along with while you're watching the Youtube video or just as a reminder, of after I've watched the YouTube video, this is my step-by-step, for you know, uploading a preregistration or something like that"
6,1,Austin Thompson,8/14/2023 18:49,LP-V,"And I agree that being able to kind of jump around in a Youtube video is really nice. Or just having them in really short snippet. So here's a 5 minute introduction on X or on Y, and then, having, you know, a handout that's related to it, so that you have, like the step-by-step on a piece of paper that you could potentially follow along with while you're watching the Youtube video or just as a reminder, of after I've watched the YouTube video, this is my step-by-step, for you know, uploading a preregistration or something like that."
6,11,Austin Thompson,8/14/2023 18:52,"LP-WG, LP-I","as I'm going through this for my purposes and learning to to go through the open science from the beginning of an experiment, research project, whatever, to the end it would be like, it would be beneficial to have like a cohort group of hey, i'm going to start an open science project, and we'll meet once a month between this time and this time. And where are you? What do you need? What's the current problem? Just to to, like an interactive work group, rather than a workshop."
6,24,Austin Thompson,8/14/2023 18:55,B-PR,So I I'll I'll. My contribution is really short. It's just honestly my own organizational practices are the biggest barrier for me preregistering.
6,24,Austin Thompson,8/14/2023 18:55,B-LOO,It's just honestly my own organizational practices are the biggest barrier for me preregistering.
6,27,Austin Thompson,8/14/2023 18:56,"B-PR, B-F",It's kind of the vulnerability of posting your ideas before you've done this study.
6,31,Austin Thompson,8/14/2023 19:02,"PE-PR, B-PD","And, you know I have been in a situation where we preregistered the protocol, and also published the protocol for something, and I mean a peer viewer should have recused themself but they tried to to deny the article or reject the article because they were doing something similar. So it was kind of a weird situation, and so that kind of left a bad taste in my mouth."
6,33,Austin Thompson,8/14/2023 19:04,KOP-PR,I think there's also different stages where you can preregister.
6,38,Austin Thompson,8/14/2023 19:05,"F-DC, F-PR","So I find it a good time to preregister is when you’ve collected the data, but you haven't analyzed it yet. So you like, kind of have a sense of like what your age group is, and how many kids, I work with kids. How many kids you've already recruited to participate. So, like you haven't done any of like the data cleaning or the data processing or the analyses. So you still have really sound research questions, hypotheses, and methods. But you've already kind of collected the data."
6,39,Austin Thompson,8/14/2023 19:06,PE-PR,"So I find it a good time to preregister is when you’ve collected the data, but you haven't analyzed it yet. So you like, kind of have a sense of like what your age group is, and how many kids, I work with kids. How many kids you've already recruited to participate. So, like you haven't done any of like the data cleaning or the data processing or the analyses. So you still have really sound research questions, hypotheses, and methods. But you've already kind of collected the data. So, the most recent preregistration I did, we did it in that format."
6,41,Austin Thompson,8/14/2023 19:08,LP-C,And so also create the education around. What types of pre registrations out there. When is it a good time to pre register to kind of help with some of those barriers.
6,42,Danika Pfeiffer,10/3/2023 23:20,"CI-A, F-PR","But I think for me, I actually find it a huge advantage because it really gets you set up to get ready to go."
6,44,Austin Thompson,8/14/2023 19:09,"B-LOO, B-T, B-PR",But I agree with the previous comment that just getting yourself organized and put together like even writing the preregistration can take weeks to get yourself set up and ready to go
7,2,Austin Thompson,8/14/2023 19:13,"B-PR, B-CM","If there's any changes from your preregistration, and you're writing it in your manuscript, you tend to have to take the space to then explain that the differences between what you preregistered and what actually happened. So, depending on word count and things like that that could potentially be a barrier."
7,9,Austin Thompson,8/14/2023 19:18,"F-B, F-PR","So I think I would be motivated by, if there is some sort of direct benefit to me of doing this,"
7,11,Austin Thompson,8/14/2023 19:18,"B-PR, B-NE","because right now I feel like I'm I lack the motivation to do right preregistration, because it's not something that is, looked for, say, in my promotion or tenure reviews, and it's not valued by my university."
7,12,Austin Thompson,8/14/2023 19:20,"F-PR, F-E","So, if it were something that became an expectation within my department or college or university."
7,19,Austin Thompson,8/14/2023 19:23,U-PR,"I do have a question about this process like when I write IRBs, I'm doing all of this. Like, I've taken the time to write the research question and the methods. And you know, then, once it gets approved and all those forms are in place, then I would feel comfortable. I don't know copying, or having IRB send that information to preregister."
7,20,Austin Thompson,8/14/2023 19:24,"B-PR, B-T","But having to duplicate that work. You know, I don't have time for that, as some of you've already said,"
7,22,Austin Thompson,8/14/2023 19:24,U-PR,so does anyone know if there's sort of like this once you've been approved by IRB whether that information can be sent as a preregistration for this process?
7,30,Austin Thompson,8/14/2023 19:26,A-OD,The only thing different is that I'd say my main source of familiarity with open access is  through the talk bank records.
7,38,Austin Thompson,8/14/2023 19:28,B-KJP,"It kind of came up earlier, but just keeping track of what versions are allowed for which journal. "
7,40,Austin Thompson,8/14/2023 19:26,B-SA,"It kind of came up earlier, but just keeping track of what versions are allowed for which journal. And every time I look into, you know, dig into the requirements for the journal, and I pull up the page, and I use the site that you can search for requirements. And still, it's really confusing to me."
7,40,Austin Thompson,8/14/2023 19:27,B-CX,"And every time I look into, you know, dig into the requirements for the journal, and I pull up the page, and I use the site that you can search for requirements. And still, it's really confusing to me."
7,42,Austin Thompson,8/14/2023 19:29,"PE-SA, PE-NIH","And then, so most of my work has been NIH-funded, which typically allows for open access after a year. So, I've sort of defaulted to, well, I'll just wait a year, and then I can make that version available."
8,1,Austin Thompson,8/14/2023 19:36,"B-T, PW","I think this also came up earlier, but just having the time also to make a personal website."
8,4,Austin Thompson,8/14/2023 19:41,B-I,The university has a special format of how they want you to have your profile set up on the University website. So there's limitations to perhaps what can be posted there.
8,6,Austin Thompson,8/14/2023 19:43,"PE-SA, PW, B-T","So yeah, I I did make myself a personal website, and it does take a lot of time and work, and<P>kind of wonder if it's really, you know, worth it."
8,6,Austin Thompson,8/14/2023 19:41,B-SA,"I think this also came up earlier, but just having the time also to make a personal website. Some like, I think it was X who mentioned that that there's some, you know, formats. The university has a special format of how they want you to have your profile set up on the University website. So there's limitations to perhaps what can be posted there.<P>So yeah, I I did make myself a personal website, and it does take a lot of time and work, and<P>kind of wonder if it's really, you know, worth it. But that's that's my main area."
8,15,Austin Thompson,8/14/2023 19:44,"F-SA, F-IS, PE-SA","My previous institution had a very active librarian and a seamless, like, once a quarter we got a reminder email. Hey? Have you gotten any articles submitted or published? Would you like to archive them? And all I had to do was send them the title and the the journal, and they did all the contacting and figured out which draft needed to be...it was wonderful."
8,24,Austin Thompson,8/14/2023 19:47,U-SA,"I'm like I don't actually know how to get this done the standard way, let alone this more equitable, open access way which I believe in. I just am still feel like I'm figuring out sort of the rules of the road, like the road more traveled."
